{
  "$schema": "https://json-schema.org/draft/2020-12/schema",
  "$id": "https://fpl-lab.local/schemas/optimizer_runs.json",
  "title": "Optimiser run",
  "type": "object",
  "additionalProperties": false,
  "required": [
    "run_id",
    "horizon",
    "observed_at",
    "available_at",
    "provenance"
  ],
  "properties": {
    "run_id": {
      "type": "string"
    },
    "horizon": {
      "type": "integer"
    },
    "objective": {
      "type": "string"
    },
    "published_at": {
      "$ref": "../_defs.json#/$defs/iso_datetime"
    },
    "observed_at": {
      "$ref": "../_defs.json#/$defs/iso_datetime"
    },
    "effective_at": {
      "$ref": "../_defs.json#/$defs/iso_datetime"
    },
    "finalised_at": {
      "$ref": "../_defs.json#/$defs/iso_datetime"
    },
    "available_at": {
      "$ref": "../_defs.json#/$defs/iso_datetime"
    },
    "provenance": {
      "$ref": "../_defs.json#/$defs/provenance"
    }
  }
}
